year;name;surname;sex;birth;death;country;contribution-sk;contribution-en
1901;Jacobus Henricus ;van ’t Hoff;M;1852;1911;Netherlands;ako uznanie za výnimočné služby ktoré poskytol svojim objavom zákonov chemickej dynamiky a osmotického tlaku v roztokoch;for his discovery of the laws of chemical dynamics and osmotic pressure in solutions
1902;Hermann Emil ;Fischer;M;1852;1919;Germany;ako uznanie za výnimočné služby ktoré poskytol svojou prácou na syntéze cukrov a purínov;for his work on sugar and purine syntheses
1903;Svante August ;Arrhenius;M;1859;1927;Sweden;ako uznanie za výnimočné služby ktoré poskytol pri pokroku v chémii svojou elektrolytickou teóriou disociácie;for his electrolytic theory of dissociation
1904;Sir William ;Ramsay;M;1852;1916;United Kingdom;ako uznanie za služby pri objave inertných plynných prvkov vo vzduchu a za určenie ich miesta v periodickom systéme;for his discovery of the inert gaseous elements in air, and his determination of their place in the periodic system
1905;Johann Friedrich Wilhelm Adolf Ritter ;von Baeyer;M;1835;1917;Germany;ako uznanie za služby pri pokroku v organickej chémii a v chemickom priemysle prostredníctvom svojej práce na organických farbivách a hydroaromatických zlúčeninách;for the advancement of organic chemistry and the chemical industry, through his work on organic dyes and hydroaromatic compounds
1906;Ferdinand Frederick Henri ;Moissan;M;1852;1907;France;ako uznanie za výnimočné služby ktoré poskytol svojim výskumom a izoláciou prvku fluór, ako aj za vývoj elektrickej pece, ktorá je po ňom pomenovaná;for his investigation and isolation of the element fluorine, and for [the electric furnace called after him
1907;Eduard ;Buchner;M;1860;1917;Germany;za svoj biochemický výskum a za objav bezbunkového kvasenia;for his biochemical researches and his discovery of cell-free fermentation
1908;Sir Ernest ;Rutherford;M;1871;1937;United Kingdom,New Zealand;za svoj výskum v oblasti rozpadu prvkov a chémie rádioaktívnych látok;for his investigations into the disintegration of the elements, and the chemistry of radioactive substances
1909;Friedrich Wilhelm ;Ostwald;M;1853;1932;Germany;ako uznanie za prácu v oblasti katalýzy a za svoj výskum v oblasti základných princípov riadiacich chemickú rovnováhu a rýchlosť reakcie;for his work on catalysis and for his investigations into the fundamental principles governing chemical equilibria and rates of reaction
1910;Otto ;Wallach;M;1847;1931;Germany;za jeho prácu na poli acyklických zlúčenín;for his services to organic chemistry and the chemical industry by his pioneer work in the field of alicyclic compounds
1911;Maria ;Curie-Skłodowska;F;1867;1934;Poland,France;za jej objav rádia a polónia a ďalšieho štúdia rádia;for the discovery of the elements radium and polonium, by the isolation of radium and the study of the nature and compounds of this remarkable element
1912;François Auguste Victor ;Grignard;M;1871;1935;France;za jeho objav Grignardovho činidla;for the discovery of the  Grignard reagent
1912;Paul;Sabatier;M;1854;1941;France;za jeho metódu hydrogenácie organických zlúčenín;for his method of hydrogenating organic compounds in the presence of finely disintegrated metals
1913;Alfred;Werner;M;1866;1919;Switzerland;za jeho prácu na spájaní atómov v molekulách;for his work on the linkage of atoms in molecules  especially in inorganic chemistry
1914;Theodore William ;Richards;M;1868;1928;United States;za jeho určenie atómovej hmotnosti veľkého počtu prvkov;for his accurate determinations of the atomic weight of a large number of chemical elements
1915;Richard Martin ;Willstätter;M;1872;1942;Germany;za jeho výskum rastlinných pigmentov;for his researches on plant pigments, especially chlorophyll
1918;Fritz ;Haber;M;1868;1934;Germany;za jeho syntézu amoniaku;for the synthesis of ammonia from its elements
1920;Walther Hermann ;Nernst;M;1864;1941;Germany;za jeho prácu v termochémii;for his work in thermochemistry
1921;Frederick ;Soddy;M;1877;1956;United Kingdom;za jeho prácu na chémii rádioaktívnych látok a výskum izotopov;for his contributions to our knowledge of the chemistry of radioactive substances, and his investigations into the origin and nature of isotopes
1922;Francis William ;Aston;M;1877;1945;United Kingdom;za jeho objav izotopov veľkého množstva nerádioaktívnych prvkov a za jeho celočíselné pravidlo;for his discovery, by means of his mass spectrograph, of isotopes, in a large number of non-radioactive elements, and for his enunciation of the whole-number rule
1923;Fritz ;Pregl;M;1869;1930;Austria,Kingdom of Yugoslavia;za jeho objav metódy mikroanalýzy organických látok;for his invention of the method of micro-analysis of organic substances
1925;Richard Adolf ;Zsigmondy;M;1865;1929;Germany,Hungary;za jeho dôkaz heterogénnej podstaty koloidných roztokov a použité metódy;for his demonstration of the heterogeneous nature of colloid solutions and for the methods he used
1926;Theodor ;Svedberg;M;1884;1971;Sweden;za jeho prácu na disperzných systémoch;for his work on disperse systems
1927;Heinrich Otto ;Wieland;M;1877;1957;Germany;za jeho objav bilových kyselín a príbuzných látok;for his investigations of the constitution of the bile acids and related substances
1928;Adolf Otto Reinhold ;Windaus;M;1876;1959;Germany;za jeho výskum sterolov a ich spojenie s vitamínmi;for his research into the constitution of the sterols and their connection with the vitamins
1929;Arthur ;Harden;M;1865;1940;United Kingdom;za ich objav fermentácie cukrov a fermentívnych enzýmov;for their investigations on the fermentation of sugar and fermentative enzymes
1929;Hans Karl August Simon ;von Euler-Chelpin;M;1873;1964;Sweden,Germany;za ich objav fermentácie cukrov a fermentívnych enzýmov;for their investigations on the fermentation of sugar and fermentative enzymes
1930;Hans;Fischer;M;1881;1945;Germany;za jeho výskum hemínu a chlorofylu;for his researches into the constitution of haemin and chlorophyll and especially for his synthesis of haemin
1931;Carl;Bosch;M;1874;1940;Germany;za ich príspevky k chemickým vysokotlakovým metódam;for their contributions to the invention and development of chemical high pressure methods
1931;Friedrich Karl Rudolph ;Bergius;M;1884;1949;Germany;za ich príspevky k chemickým vysokotlakovým metódam;for their contributions to the invention and development of chemical high pressure methods
1932;Irving ;Langmuir;M;1881;1957;United States;za jeho prácu v hraničnej chémii;for his discoveries and investigations in surface chemistry
1934;Harold Clayton ;Urey;M;1893;1981;United States;za jeho objav ťažkej vody;for his discovery of heavy hydrogen
1935;Frédéric ;Joliot-Curie;M;1900;1958;France;za ich syntézu nových rádioaktívnych prvkov;for their synthesis of new radioactive elements
1935;Irène ;Joliot-Curie;F;1897;1956;France;za ich syntézu nových rádioaktívnych prvkov;for their synthesis of new radioactive elements
1936;Petrus Josephus Wilhelmus ;Debye;M;1884;1966;Netherlands;za jeho prácu na molekulárnej štruktúre výskumom dipólového momentu a difrakcie röntgenových lúčov a elektrónov v plynoch;for his work on molecular structure through his investigations on dipole moments and the diffraction of X-rays and electrons in gases
1937;Sir Walter Norman ;Haworth;M;1883;1950;United Kingdom;za jeho prácu na uhľovodíkoch a vitamíne C;for his investigations on carbohydrates and vitamin C
1937;Paul;Karrer;M;1889;1971;Switzerland;za jeho prácu na karotenoidoch, flavínoch a vitamínoch A a B2;for his investigations on carotenoids, flavins and vitamins A and B2
1938;Richard;Kuhn;M;1900;1967;Germany;za jeho prácu na karotenoidoch a vitamínoch;for his work on carotenoids and vitamins
1939;Adolf Friedrich Johann ;Butenandt;M;1903;1995;Germany;za jeho prácu o pohlavných hormónoch;for his work on sex hormones
1939;Leopold ;Ružička;M;1887;1976;Kingdom of Yugoslavia,Switzerland;za jeho prácu na polymethylénoch a vyšších terpénoch;for his work on polymethylenes and higher terpenes
1943;György ;Hevesy;M;1885;1966;Hungary;za jeho prácu na využití izotopov ako značkovačov pre štúdium chemických procesov;for his work on the use of isotopes as tracers in the study of chemical processes
1944;Otto ;Hahn;M;1879;1968;Germany;za jeho objav štiepenia ťažkých atómových jadier;for his discovery of the fission of heavy nuclei
1945;Artturi Ilmari ;Virtanen;M;1895;1973; Finland;za jeho výskum v chémii agrikultúry a výživy;for his research and inventions in agricultural and nutrition chemistry, especially for his fodder preservation method
1946;James Batcheller ;Sumner;M;1887;1955;United States;za jeho objav, že enzýmy je možné kryštalizovať;for his discovery that enzymes can be crystallized
1946;John Howard ;Northrop;M;1891;1987;United States;za ich prípravu enzýmov a vírových proteínov v čistej forme;for their preparation of enzymes and virus proteins in a pure form
1946;Wendell Meredith ;Stanley;M;1904;1971;United States;za ich prípravu enzýmov a vírových proteínov v čistej forme;for their preparation of enzymes and virus proteins in a pure form
1947;Sir Robert ;Robinson;M;1886;1975;United Kingdom;za jeho výskum rastlinných produktov, obzvlášť alkaloidov;for his investigations on plant products of biological importance, especially the alkaloids
1948;Arne Wilhelm Kaurin ;Tiselius;M;1902;1971;Sweden;za jeho výskum elektroforézy a adsorpčnú analýzu;for his research on electrophoresis and adsorption analysis, especially for his discoveries concerning the complex nature of the serum proteins
1949;William Francis ;Giauque;M;1895;1982;United States;za jeho príspevky v poli chemickej termodynamiky;for his contributions in the field of chemical thermodynamics, particularly concerning the behaviour of substances at extremely low temperatures
1950;Otto Paul Hermann ;Diels;M;1876;1954;West Germany;za ich objav a vývoj diénovej syntézy (Diels-Alderova reakcia);for their discovery and development of the diene synthesis
1950;Kurt ;Alder;M;1902;1958;West Germany;za ich objav a vývoj diénovej syntézy (Diels-Alderova reakcia);for their discovery and development of the diene synthesis
1951;Edwin Mattison;McMillan;M;1907;1991;United States;za ich objavy v chémii transuránových prvkov;for their discoveries in the chemistry of transuranium elements
1951;Glenn Theodore ;Seaborg;M;1912;1999;United States;za ich objavy v chémii transuránových prvkov;for their discoveries in the chemistry of transuranium elements
1952;Archer John ;Porter Martin;M;1910;2002;United Kingdom;za ich vynález časticovej chromatografie;for their invention of partition chromatography
1952;Richard Laurence ;Millington Synge;M;1914;1994;United Kingdom;za ich vynález časticovej chromatografie;for their invention of partition chromatography
1953;Hermann ;Staudinger;M;1881;1965;West Germany;za ich objavy na poli makromolekulárnej chémie;for his discoveries in the field of macromolecular chemistry
1954;Linus Carl ;Pauling;M;1901;1994;United States;za jeho výskum podstaty chemickej väzby;for his research into the nature of the chemical bond and its application to the elucidation of the structure of complex substances
1955;Vincent ;du Vigneaud;M;1901;1978;United States;za jeho prácu na zlúčeninách síry, obzvlášť prvej syntéze polypeptidického hormónu;for his work on biochemically important sulphur compounds, especially for the first synthesis of a polypeptide hormone
1956;Sir Cyril Norman ;Hinshelwood;M;1897;1967;United Kingdom;za ich výskum mechanizmu chemických reakcií;for their researches into the mechanism of chemical reactions
1956;Nikolaj Nikolajevič ;Semionov;M;1896;1986;Soviet Union;za ich výskum mechanizmu chemických reakcií;for their researches into the mechanism of chemical reactions
1957;Sir Alexander R. ;Todd;M;1907;1997;United Kingdom;za jeho prácu na nukleotidoch a koenzýmoch nukleotidov;for his work on nucleotides and nucleotide co-enzymes
1958;Frederick;Sanger;M;1918;2013;United Kingdom;za jeho prácu na primárnej štruktúre proteínov, obzvlášť inzulínu;for his work on the structure of proteins, especially that of insulin
1959;Jaroslav;Heyrovský;M;1890;1967;Czechoslovakia;za jeho objav a vývoj polarografických metód analýzy;for his discovery and development of the polarographic methods of analysis
1960;Willard Frank ;Libby;M;1908;1980;United States;za jeho metódu využitia uhlíka-14 pre určovanie veku;for his method to use carbon-14 for age determination in archaeology, geology, geophysics, and other branches of science
1961;Melvin ;Calvin;M;1911;1997;United States;za jeho výskum v oblasti využívania oxidu uhličitého v rastlinách;for his research on the carbon dioxide assimilation in plants
1962;Max Ferdinand ;Perutz;M;1914;2002;United Kingdom;za ich výskum štruktúr globulárnych bielkovín;for their studies of the structures of globular proteins
1962;John Cowdery;Kendrew;M;1917;1997;United Kingdom;za ich výskum štruktúr globulárnych bielkovín;for their studies of the structures of globular proteins
1963;Karl Waldemar ;Ziegler;M;1898;1973;West Germany;za ich objavy vzťahujúce sa na vyššie polyméry;for their discoveries in the field of the chemistry and technology of high polymers
1963;Giulio ;Natta;M;1903;1979;Italy;za ich objavy vzťahujúce sa na vyššie polyméry;for their discoveries in the field of the chemistry and technology of high polymers
1964;Dorothy Mary Crowfoot;Hodgkin;F;1910;1994;United Kingdom;za jej odhodlanie a úspechy v použití röntgenových lúčov na výskum štruktúr dôležitých biochemických látok;for her determinations by X-ray techniques of the structures of important biochemical substances
1965;Robert Burns ;Woodward;M;1917;1979;United States;za jeho úspechy v organickej syntéze;for his outstanding achievements in the art of organic synthesis
1966;Robert S.;Mulliken;M;1896;1986;United States;za jeho prácu na chemických väzbách a elektronickej štruktúre molekúl;for his fundamental work concerning chemical bonds and the electronic structure of molecules by the molecular orbital method
1967;Manfred ;Eigen;M;1927;2019;West Germany;za ich štúdium extrémne rýchlych chemických reakcií;for their studies of extremely fast chemical reactions, effected by disturbing the equilibrium by means of very short pulses of energy
1967;Ronald George;Wreyford Norrish;M;1897;1978;United Kingdom;za ich štúdium extrémne rýchlych chemických reakcií;for their studies of extremely fast chemical reactions, effected by disturbing the equilibrium by means of very short pulses of energy
1967;George ;Porter;M;1920;2002;United Kingdom;za ich štúdium extrémne rýchlych chemických reakcií;for their studies of extremely fast chemical reactions, effected by disturbing the equilibrium by means of very short pulses of energy
1968;Lars ;Onsager;M;1903;1976;United States,Norway;za objav recipročných relácií nesúcich jeho meno;for the discovery of the reciprocal relations bearing his name, which are fundamental for the thermodynamics of irreversible processes
1969;Derek Harold Richard ;Barton;M;1918;1998;United Kingdom;za jeho príspevky o vývoji konceptu konformácií;for their contributions to the development of the concept of conformation and its application in chemistry
1969;Odd ;Hassel;M;1897;1981;Norway;za jeho príspevky o vývoji konceptu konformácií;for their contributions to the development of the concept of conformation and its application in chemistry
1970;Luis Federico ;Leloir;M;1906;1987;Argentina;za jeho objav sacharidových nukleotidov a odhalenie ich úlohy v biosyntéze cukrov;for his discovery of sugar nucleotides and their role in the biosynthesis of carbohydrates
1971;Gerhard ;Herzberg;M;1904;1999;Canada,West Germany;za jeho príspevky k elektrónovej štruktúre a geometrii molekúl, hlavne voľných radikálov;for his contributions to the knowledge of electronic structure and geometry of molecules, particularly free radicals
1972;Christian Boehmer ;Anfinsen;M;1916;1995;United States;za jeho prácu na ribonukleáze;for his work on ribonuclease, especially concerning the connection between the amino acid sequence and the biologically active conformation
1972;Stanford ;Moore;M;1913;1982;United States;za jeho príspevok k pochopeniu spojenia medzi chemickou štruktúrou a katalytickou aktivitou ribonukleovej molekuly;for their contribution to the understanding of the connection between chemical structure and catalytic activity of the active centre of the ribonuclease molecule
1972;William Howard ;Stein;M;1911;1980;United States;za jeho príspevok k pochopeniu spojenia medzi chemickou štruktúrou a katalytickou aktivitou ribonukleovej molekuly;for their contribution to the understanding of the connection between chemical structure and catalytic activity of the active centre of the ribonuclease molecule
1973;Ernst Otto ;Fischer;M;1918;2007;West Germany;za jeho prácu na chémii organokovových zlúčenín;for their pioneering work, performed independently, on the chemistry of the organometallic, so called sandwich compounds
1973;Geoffrey ;Wilkinson;M;1921;1996;United Kingdom;za jeho prácu na chémii organokovových zlúčenín;for their pioneering work, performed independently, on the chemistry of the organometallic, so called sandwich compounds
1974;Paul John ;Flory;M;1910;1985;United States;za jeho základnú prácu, tak teoretickú ako aj experimentálnu, v oblasti fyzikálnej chémie makromolekúl;for his fundamental work, both theoretical and experimental, in the physical chemistry of macromolecules
1975;John Warcup ;Cornforth;M;1917;2013;Australia,United Kingdom;za jeho prácu na stereochémii enzýmovo-katalyzovaných reakcií;for his work on the stereochemistry of enzyme-catalyzed reactions
1975;Vladimir ;Prelog;M;1906;1998;Yugoslavia,Switzerland;za jeho výskum v stereochémii organických molekúl a reakcií;for his research into the stereochemistry of organic molecules and reactions
1976;William N.;Lipscomb;M;1919;2011;United States;za jeho štúdium štruktúry bórovodíkov;for his studies on the structure of boranes illuminating problems of chemical bonding
1977;Ilya ;Prigogine;M;1917;2003;Belgium;za jeho príspevky k nerovnovážnej termodynamike;for his contributions to non-equilibrium thermodynamics, particularly the theory of dissipative structures
1978;Peter Dennis ;Mitchell;M;1920;1992;United Kingdom;za jeho formuláciu chemiosmotickej teórie;for his contribution to the understanding of biological energy transfer through the formulation of the chemiosmotic theory
1979;Herbert Charles ;Brown;M;1912;2004;United States;za ich spoločný rozvoj použitia zlúčenín obsahujúcich bór a fosfor, samostatne, za činidlá v organickej syntéze;for their development of the use of boron- and phosphorus-containing compounds, respectively, into important reagents in organic synthesis
1979;Georg;Wittig;M;1897;1987;West Germany;za ich spoločný rozvoj použitia zlúčenín obsahujúcich bór a fosfor, samostatne, za činidlá v organickej syntéze;for their development of the use of boron- and phosphorus-containing compounds, respectively, into important reagents in organic synthesis
1980;Paul;Berg;M;1926;2023;United States;za jeho základné štúdium biochémie nukleových kyselín, a zvlášť rekombinátu-DNA;for his fundamental studies of the biochemistry of nucleic acids, with particular regard to recombinant-DNA
1980;Walter;Gilbert;M;1932;;United States;za ich príspevky týkajúce sa určenia bázových postupností v nukleových kyselinách;for their contributions concerning the determination of base sequences in nucleic acids
1980;Frederick;Sanger;M;1918;2013;United Kingdom;za ich príspevky týkajúce sa určenia bázových postupností v nukleových kyselinách;for their contributions concerning the determination of base sequences in nucleic acids
1981;Kenichi;Fukui;M;1918;1998;Japan;za ich teórie teórie v oblasti priebehu chemických reakcií;for their theories, developed independently, concerning the course of chemical reactions
1981;Roald;Hoffmann;M;1937;;United States,Poland;za ich teórie teórie v oblasti priebehu chemických reakcií;for their theories, developed independently, concerning the course of chemical reactions
1982;Aaron;Klug;M;1926;2018;United Kingdom;za jeho rozvoj kryštalografického elektrónového mikroskopu;for his development of crystallographic electron microscopy and his structural elucidation of biologically important nucleic acid-protein complexes
1983;Henry;Taube;M;1915;2005;United States;za jeho prácu na mechanizme reakcií s presunom elektrónov;for his work on the mechanisms of electron transfer reactions, especially in metal complexes
1984;Robert Bruce ;Merrifield;M;1921;2006;United States;za jeho rozvoj metodológie chemickej syntézy na pevných matrixoch;for his development of methodology for chemical synthesis on a solid matrix
1985;Herbert Aaron ;Hauptman;M;1917;2011;United States;za ich úspechy vo vývoji priamych metód určovania kryštálových štruktúr;for their outstanding achievements in developing direct methods for the determination of crystal structures
1985;Jerome ;Karle;M;1918;2013;United States;za ich úspechy vo vývoji priamych metód určovania kryštálových štruktúr;for their outstanding achievements in developing direct methods for the determination of crystal structures
1986;Dudley Robert ;Herschbach;M;1932;;United States;za ich príspevky v oblasti dynamiky elementárnych chemických procesov;for their contributions concerning the dynamics of chemical elementary processes
1986;Yuan Tseh ;Lee;M;1936;;United States,Republic of China;za ich príspevky v oblasti dynamiky elementárnych chemických procesov;for their contributions concerning the dynamics of chemical elementary processes
1986;John Charles ;Polanyi;M;1929;;Canada,Hungary;za ich príspevky v oblasti dynamiky elementárnych chemických procesov;for their contributions concerning the dynamics of chemical elementary processes
1987;Donald James ;Cram;M;1919;2001;United States;za ich vývoj a použitie molekúl so štruktúrovo-špecifickými interakciami vysokej selektivity;for their development and use of molecules with structure-specific interactions of high selectivity
1987;Jean-Marie ;Lehn;M;1939;;France;za ich vývoj a použitie molekúl so štruktúrovo-špecifickými interakciami vysokej selektivity;for their development and use of molecules with structure-specific interactions of high selectivity
1987;Charles John ;Pedersen;M;1904;1989;United States;za ich vývoj a použitie molekúl so štruktúrovo-špecifickými interakciami vysokej selektivity;for their development and use of molecules with structure-specific interactions of high selectivity
1988;Johann;Deisenhofer;M;1943;;West Germany;za ich práce o trojrozmernej štruktúre centier fotosyntézy;for their determination of the three-dimensional structure of a photosynthetic reaction centre
1988;Robert;Huber;M;1937;;West Germany;za ich práce o trojrozmernej štruktúre centier fotosyntézy;for their determination of the three-dimensional structure of a photosynthetic reaction centre
1988;Hartmut;Michel;M;1948;;West Germany;za ich práce o trojrozmernej štruktúre centier fotosyntézy;for their determination of the three-dimensional structure of a photosynthetic reaction centre
1989;Sidney;Altman;M;1939;2022;Canada,United States;za ich objav katalytických vlastností RNA;for their discovery of catalytic properties of RNA
1989;Thomas Robert ;Cech;M;1947;;United States;za ich objav katalytických vlastností RNA;for their discovery of catalytic properties of RNA
1990;Elias James ;Corey;M;1928;;United States;za jeho rozvoj teórie a metodológie organickej syntézy;for his development of the theory and methodology of organic synthesis
1991;Richard Robert ;Ernst;M;1933;2021;Switzerland;za jeho príspevky k rozvoju magnetickej nukleárnej rezonancie s vysokým rozlíšením;for his contributions to the development of the methodology of high resolution nuclear magnetic resonance (NMR) spectroscopy
1992;Rudolph Arthur ;Marcus;M;1923;;United States,Canada;za jeho príspevky k teórii reakcií s presunom elektrónov v chemických systémoch;for his contributions to the theory of electron transfer reactions in chemical systems
1993;Kary Banks ;Mullis;M;1944;2019;United States;za príspevky k rozvoju metód v chémii DNA;for contributions to the developments of methods within DNA-based chemistry  for his invention of the polymerase chain reaction (PCR) method
1993;Michael ;Smith;M;1932;2000;Canada;za príspevky k rozvoju metód v chémii DNA;for contributions to the developments of methods within DNA-based chemistry  for his fundamental contributions to the establishment of oligonucleotide-based, site-directed mutagenesis and its development for protein studies
1994;George Andrew ;Olah;M;1927;2017;United States,Hungary;za jeho príspevok k chémii karbokatiónov;for his contribution to carbocation chemistry
1995;Paul Josef ;Crutzen;M;1933;2021;Netherlands;za ich prácu na chémii atmosféry, hlavne na spotrebe ozónu;for their work in atmospheric chemistry, particularly concerning the formation and decomposition of ozone
1995;Mario J. ;Molina;M;1943;2020;Mexico;za ich prácu na chémii atmosféry, hlavne na spotrebe ozónu;for their work in atmospheric chemistry, particularly concerning the formation and decomposition of ozone
